{
  "$schema": "http://json-schema.org/draft-07/schema#",
  "title": "Agent Communication Protocol Schema",
  "description": "Schema for inter-agent messages in the agent-comms-mvp system",
  "type": "object",
  "required": ["type", "id", "timestamp", "sender", "recipient", "content", "version"],
  "properties": {
    "type": {
      "type": "string",
      "enum": ["task_assignment", "task_status", "error"],
      "description": "Type of message being sent"
    },
    "id": {
      "type": "string",
      "format": "uuid",
      "description": "Unique message identifier (UUID v4)"
    },
    "timestamp": {
      "type": "string",
      "format": "date-time",
      "description": "ISO 8601 timestamp of message creation"
    },
    "sender": {
      "type": "string",
      "enum": ["CC", "CA", "WA", "ARCH"],
      "description": "Identifier of the sending agent"
    },
    "recipient": {
      "type": "string",
      "enum": ["CC", "CA", "WA", "ARCH"],
      "description": "Identifier of the receiving agent"
    },
    "content": {
      "type": "object",
      "description": "Message content, varies by type",
      "oneOf": [
        {
          "if": {
            "properties": { "type": { "const": "task_assignment" } }
          },
          "then": {
            "properties": {
              "task_id": {
                "type": "string",
                "pattern": "^TASK-\\d{3}$",
                "description": "Unique task identifier"
              },
              "description": {
                "type": "string",
                "description": "Task description"
              },
              "priority": {
                "type": "integer",
                "minimum": 1,
                "maximum": 5,
                "description": "Task priority (1-5)"
              },
              "deadline": {
                "type": "string",
                "format": "date-time",
                "description": "Task deadline"
              },
              "requirements": {
                "type": "array",
                "items": {
                  "type": "string"
                },
                "description": "List of task requirements"
              }
            },
            "required": ["task_id", "description", "priority", "deadline", "requirements"]
          }
        },
        {
          "if": {
            "properties": { "type": { "const": "task_status" } }
          },
          "then": {
            "properties": {
              "task_id": {
                "type": "string",
                "pattern": "^TASK-\\d{3}$",
                "description": "Task identifier"
              },
              "status": {
                "type": "string",
                "enum": ["pending", "in_progress", "completed", "failed", "cancelled"],
                "description": "Current task status"
              },
              "progress": {
                "type": "integer",
                "minimum": 0,
                "maximum": 100,
                "description": "Task completion percentage"
              },
              "details": {
                "type": "string",
                "description": "Additional status details"
              }
            },
            "required": ["task_id", "status", "progress", "details"]
          }
        },
        {
          "if": {
            "properties": { "type": { "const": "error" } }
          },
          "then": {
            "properties": {
              "error_code": {
                "type": "string",
                "enum": ["INVALID_MESSAGE", "FILE_NOT_FOUND", "PROCESSING_ERROR", "INVALID_TASK"],
                "description": "Error code identifier"
              },
              "message": {
                "type": "string",
                "description": "Human-readable error message"
              },
              "context": {
                "type": "object",
                "description": "Additional error context",
                "properties": {
                  "task_id": {
                    "type": "string",
                    "pattern": "^TASK-\\d{3}$"
                  },
                  "attempted_path": {
                    "type": "string"
                  }
                }
              }
            },
            "required": ["error_code", "message", "context"]
          }
        }
      ]
    },
    "version": {
      "type": "string",
      "pattern": "^\\d+\\.\\d+\\.\\d+$",
      "description": "Protocol version (e.g., 1.0.0)"
    },
    "metadata": {
      "type": "object",
      "description": "Optional metadata for the message",
      "properties": {
        "protocol_version": {
          "type": "string",
          "pattern": "^\\d+\\.\\d+\\.\\d+$"
        }
      }
    }
  }
} 