{
  "type": "task_status",
  "id": "c3d42f89-6a21-4832-b789-123456789012",
  "timestamp": "2025-05-18T08:45:00Z",
  "sender": "CC",
  "recipient": "ARCH",
  "version": "1.0.0",
  "content": {
    "task_id": "TASK-007",
    "status": "completed",
    "progress": 100,
    "details": "Implemented agent_runner.py CLI tool with message validation, task execution simulation, logging, and status reporting. Branch pushed and ready for review."
  },
  "metadata": {
    "protocol_version": "1.0.0",
    "branch": "feat/TASK-007-agent-runner"
  }
}