[
  {
    "type": "task_assignment",
    "id": "test-learning-002",
    "timestamp": "2025-01-18T10:05:00Z",
    "sender": "ARCH",
    "recipient": "CC",
    "version": "1.0.0",
    "content": {
      "task_id": "TASK-024",
      "description": "research: Test low performance warning",
      "priority": 2,
      "deadline": "2025-01-19T10:00:00Z",
      "requirements": ["Research performance metrics", "Verify warnings are logged"]
    },
    "metadata": {
      "protocol_version": "1.0.0"
    }
  }
]