{
  "type": "task_status",
  "id": "550e8400-e29b-41d4-a716-446655440001",
  "timestamp": "2024-03-20T10:05:00Z",
  "sender": "CA",
  "recipient": "ARCH",
  "version": "1.0.0",
  "content": {
    "task_id": "TASK-003",
    "status": "in_progress",
    "progress": 50,
    "details": "Created schema and task assignment example, working on status and error examples"
  },
  "metadata": {
    "protocol_version": "1.0.0"
  }
} 