[
  {
    "type": "task_status",
    "id": "f9a7d5e3-9b1c-46ad-8456-7890abcdef12",
    "timestamp": "2025-05-18T12:15:00Z",
    "sender": "CC",
    "recipient": "ARCH",
    "version": "1.0.0",
    "content": {
      "task_id": "TASK-045B",
      "status": "completed",
      "progress": 100,
      "details": "Successfully created comprehensive EXECUTION_FLOW.md documentation. PR #14 has been merged to main branch. Documentation covers all system phases, retry logic, file flow architecture, and practical examples."
    },
    "metadata": {
      "protocol_version": "1.0.0",
      "pr_merged": "PR-14",
      "files_created": ["docs/EXECUTION_FLOW.md"],
      "updated_files": ["TASK_CARDS.md"]
    }
  },
  {
    "type": "task_status",
    "id": "f9a7d5e3-9b1c-46ad-8456-7890abcdef13",
    "timestamp": "2025-05-18T12:30:00Z",
    "sender": "CC",
    "recipient": "ARCH",
    "version": "1.0.0",
    "content": {
      "task_id": "TASK-045D",
      "status": "completed",
      "progress": 100,
      "details": "Successfully reviewed and merged all documentation PRs for TASK-045A through TASK-045C. All documentation files (SYSTEM_OVERVIEW.md, EXECUTION_FLOW.md, AGENT_ARCHITECTURE.md) are now in main branch. TASK_CARDS.md has been updated to reflect completion of all TASK-045 subtasks. Feature branches have been cleaned up. Phase 4 documentation is complete and ready for Phase 5."
    },
    "metadata": {
      "protocol_version": "1.0.0",
      "tasks_completed": ["TASK-045A", "TASK-045B", "TASK-045C", "TASK-045D"],
      "files_created": [
        "docs/SYSTEM_OVERVIEW.md",
        "docs/EXECUTION_FLOW.md", 
        "docs/AGENT_ARCHITECTURE.md"
      ],
      "branches_merged": ["feat/TASK-045A-system-overview"],
      "next_phase": "Phase 5 - Web Interface"
    }
  }
]