[
  {
    "type": "task_status",
    "id": "TASK-060B-COMPLETE",
    "timestamp": "2025-05-21T18:30:00Z",
    "sender": "CC",
    "recipient": "ARCH",
    "version": "1.0.0",
    "content": {
      "task_id": "TASK-060B",
      "status": "completed",
      "progress": 100,
      "details": "Successfully connected React UI to backend API. The application now displays real-time data for agents and tasks.",
      "changes": [
        "Added API services for agents and tasks",
        "Created custom hooks for data fetching and state management",
        "Updated Dashboard and Agents pages to display real data",
        "Implemented polling for real-time updates"
      ]
    }
  },
  {
    "type": "task_status",
    "id": "TASK-063A-COMPLETE",
    "timestamp": "2025-05-21T20:10:00Z",
    "sender": "CC",
    "recipient": "ARCH",
    "version": "1.0.0",
    "content": {
      "task_id": "TASK-063A",
      "status": "completed",
      "progress": 100,
      "details": "Successfully integrated Outbox Visualizer into React UI with a new /outbox route.",
      "changes": [
        "Created outbox visualization page with real-time message monitoring",
        "Added expandable agent cards with message history",
        "Implemented JSON preview of message content",
        "Set up responsive design with Tailwind CSS",
        "Added TypeScript for type safety"
      ]
    }
  },
  {
    "type": "task_status",
    "id": "TASK-BATCH-MERGE-COMPLETE",
    "timestamp": "2025-05-21T21:30:00Z",
    "sender": "CC",
    "recipient": "ARCH",
    "version": "1.0.0",
    "content": {
      "task_id": "TASK-BATCH-MERGE",
      "status": "completed",
      "progress": 100,
      "details": "Successfully reviewed and merged all completed feature branches for the current cycle.",
      "changes": [
        "Merged feat/TASK-061F-plan-api with Plan Submission API",
        "Merged feat/TASK-060C-task-details with Task Detail Viewer (backend)",
        "Merged feat/TASK-063A-outbox-ui with Outbox Visualizer (React UI)",
        "Resolved merge conflicts in main.py and TASK_CARDS.md",
        "Updated TASK_CARDS.md to reflect all completed tasks"
      ]
    },
    "metadata": {
      "merged_branches": [
        "feat/TASK-061F-plan-api",
        "feat/TASK-060C-task-details",
        "feat/TASK-063A-outbox-ui"
      ],
      "commit_hashes": [
        "3875e75 (TASK-061F)",
        "c323366 (TASK-060C)",
        "8da6607 (TASK-063A)"
      ]
    }
  },
  {
    "type": "task_status",
    "id": "TASK-061I-COMPLETE",
    "timestamp": "2025-05-21T21:45:00Z",
    "sender": "CC",
    "recipient": "ARCH",
    "version": "1.0.0",
    "content": {
      "task_id": "TASK-061I",
      "status": "completed",
      "progress": 100,
      "details": "Successfully created comprehensive DEVELOPMENT.md documentation for Bluelabel Agent OS.",
      "changes": [
        "Added complete local setup guide for Python, Node.js, FastAPI, and React",
        "Documented monorepo architecture and component overview",
        "Created detailed instructions for running agents and system components",
        "Documented branch naming conventions and merge policy",
        "Added agent profiles and capabilities reference",
        "Included development standards and testing procedures",
        "Added troubleshooting guide and debugging tools section"
      ]
    },
    "metadata": {
      "branch": "feat/TASK-061I-dev-docs",
      "files_created": [
        "/docs/DEVELOPMENT.md"
      ],
      "files_modified": [
        "/TASK_CARDS.md"
      ],
      "commit_hash": "1e08a58"
    }
  },
  {
    "type": "task_status",
    "id": "TASK-065-COMPLETE",
    "timestamp": "2025-05-21T22:15:00Z",
    "sender": "CC",
    "recipient": "ARCH",
    "version": "1.0.0",
    "content": {
      "task_id": "TASK-065",
      "status": "completed",
      "progress": 100,
      "details": "Successfully collected and bundled all system context, protocol, and configuration files for centralized review and validation.",
      "changes": [
        "Created docs/context_bundle/ directory for centralized file collection",
        "Collected 37 files covering all system-defining components",
        "Bundled agent protocols, profiles, task templates, workflows, prompts, architecture docs, routing rules, and configuration files",
        "Preserved all original files (created duplicates only)",
        "Created comprehensive README.md index with categorized file listing",
        "Bundle ready for ARCH review, validation, and integration testing"
      ]
    },
    "metadata": {
      "bundle_directory": "/docs/context_bundle/",
      "total_files_collected": 37,
      "bundle_categories": [
        "5 agent protocol files",
        "8 agent profile/context files", 
        "5 task format templates",
        "5 workflow plans",
        "3 prompt templates",
        "5 architecture docs",
        "2 routing files",
        "3 configuration files",
        "2 main documentation files"
      ],
      "commit_hash": "26e5e2d",
      "ready_for_arch_review": true
    }
  }
]