{
  "type": "task_status",
  "id": "a1b2c3d4-5e6f-7890-abcd-ef1234567890",
  "timestamp": "2025-05-18T10:00:00Z",
  "sender": "CC",
  "recipient": "ARCH",
  "version": "1.0.0",
  "content": {
    "task_id": "TASK-010",
    "status": "completed",
    "progress": 100,
    "details": "Implemented agent self-initialization system with --init flag. Agents can now display their profiles, prompt templates, and expected behavior. Branch feat/TASK-010-agent-init pushed and ready for review."
  },
  "metadata": {
    "protocol_version": "1.0.0",
    "branch": "feat/TASK-010-agent-init"
  }
}