{
  "type": "task_status",
  "id": "d0ff5cfe-1dbb-4f0d-b534-9bbee00bf866",
  "timestamp": "2025-05-18T00:51:03.675793",
  "sender": "CA",
  "recipient": "ARCH",
  "version": "1.0.0",
  "content": {
    "task_id": "TASK-901",
    "status": "completed",
    "progress": 100,
    "details": "Task TASK-901 completed successfully (simulated execution)"
  },
  "metadata": {
    "protocol_version": "1.0.0",
    "original_message_id": "task-001"
  }
}